{
  "$comment": "Placeholder prices. Fixed tariff with night price and weekend price. First matching rule wins: on Saturday night the night price applies.",
  "id": "user_example_day_night",
  "label": "Example utility, day/night",
  "type": "fixed_cent",
  "land": "DE",
  "currency": "EUR",
  "supplier_id": "user_example",
  "fix_cent_kwh": 32.0,
  "prices_include_vat": true,
  "vat_percent": 19,
  "monthly_fee_eur": 12.9,
  "rules": [
    {
      "id": "night",
      "label": "Night tariff",
      "time": { "from": "22:00", "to": "06:00" },
      "effect": { "mode": "absolute_cent", "value": 25.0 }
    },
    {
      "id": "weekend",
      "label": "Weekend",
      "weekdays": "weekend",
      "effect": { "mode": "absolute_cent", "value": 27.0 }
    }
  ]
}
